name,price,composition,material-sum,age,category,sub_category,description,img_url,url,scrapped-at
Máscara Zero Costura Vírus Bac-Off - Kit com 2 unidades,"26,00",2% elastano 98% poliamida,1.0,Adulto,Acessórios,Máscaras,"A Máscara Zero Costura Vírus Bac Off oferece proteção contra bactérias e vírus, principalmente contra o causador da COVID 19, graças ao agente antiviral e antibacteriano inserido na matriz polimérica do fio. Esta tecnologia oferece proteção, conforto e bem estar, permanecendo por toda vida útil da peça. Feita de 98% de poliamida e 2% de elastano, a máscara deve ser colocada sobre o rosto, cobrindo todo o nariz e a boca. Antes de colocar a máscara, lave bem as mãos com água e sabão. Para retirá la, toque, apenas, na alça e higienize as mãos. A máscara Lupo pode ser lavada com uma solução de água potável e detergente. Deixe de molho por 30 minutos e, depois, realize o enxágue em água corrente. Coloque a máscara para secar à sombra e depois armazene em um lugar limpo. Proteja se e proteja quem você ama Composição: 98% Poliamida 2% Elastano. Higienizada pronta para uso, Inativa Vírus, Dupla Camada Como Colocar a Máscara: A máscara é individual e não deve ser compartilhada com ninguém, nem entre familiares. Antes de colocar a máscara, lave bem as mão com água e sabão, secando as bem, para então colocar a máscara com cuidado, cobrindo a boca e o nariz, e acomodando a com segurança para minimizar os espaços entre o rosto e a máscara. Como retirar a Máscara: Passo 1 Quando for retirar a máscara, antes, lave as mãos com água e sabão, secando as bem, para que então possa retirá la. Passo 2 Remova a máscara pegando pela tira lateral, evitando tocar na parte da frente. Passo 3 Coloque a máscara usada em um saco plástico e reserve, para assim que possível, realizar o procedimento de lavagem. Passo 4 Lave novamente as mãos, com água e sabão por no mínimo 20 segundos. Importante: Trocar a máscara sempre que apresentar sujidade ou umidade. Descartar a máscara sempre que apresentar sinais de deteriorização ou funcionalidade comprometida. O uso contínuo de altas concentrações de cloro durante a lavagem pode alterar a cor do produto, porém, suas funções permanecem inalteradas. A utilização da máscara é apenas mais uma medida de proteção sendo que não devem ser negligenciadas as outras medidas recomendadas elo Ministério da Saúde. Lavagem e higienização da Máscara: Passo 1 Chegando em casa, lave as máscaras usadas com uma solução de água potável e detergente líquido na proporção de 5ml de detergente para 1 litro de água e deixe as do molho por 30 minutos. Após o tempo de imersão, realize o enxague em água corrente. Passo 2 Deixe secar à sombra. Passo 3 Depois de seca, coloque a em um recipiente limpo, para que não haja contaminação até o uso. Lembre se que a máscara deve estar bem seca para sua reutilização. As Máscaras Zero Costura Vírus Bac Off, são básicas e essenciais para o momento que estamos vivendo. Confira também as blusas femininas manga longa e não deixe de visitar as nossas categorias para encontrar produtos acessíveis e diversos modelos de calcinha",https://lupo.vteximg.com.br/arquivos/ids/192600-500-500/36004-9000904-1.jpg?v=637638584514300000,https://www.lupo.com.br/mascara-bacoff-36004-900/p,12-04-2022
Sutiã Loba Basico Sem Costura,"47,90",6% elastano 94% poliamida,1.0,Adulto,Lingerie,Sutiã Básico,"Se você está procurando um sutiã sem costura confortável e elegante, confira as opções de tamanho e cores do Sutiã Loba Básico Sem Costura . Feita de 94% de poliamida e 6% de elastano, a lingerie Lupo diminuiu os pontos de fricção do tecido com a pele. Sua falta de costura torna este sutiã Lupo uma ótima opção para ser usado em exercícios físicos e em atividades que necessitem de muito movimento. Aqui na Lupo você encontra tudo o que precisa em produtos íntimos. Temos ainda diversos outros produtos como nossos modelos de cinta modeladora e pijamas femininos . Navegue por nossas categorias e não perca tempo Composição: 94% Poliamida, 6% Elastano",https://lupo.vteximg.com.br/arquivos/ids/180031-500-500/41100-001-5650.jpg?v=636687411712800000,https://www.lupo.com.br/sutia-loba-af-basico-41100-001/p,12-04-2022
Cueca Lupo Boxer,"36,90",5% elastano 95% algodão,1.0,Adulto,Cuecas,Boxer,"A beleza das cuecas boxer sempre chamou a atenção de todos os homens que procuram por roupas íntimas confortáveis e bonitas para usar no dia a dia. Esse modelo de cueca desenvolvido pela Lupo, por exemplo, atenda as necessidades de qualquer homem que preza pelo conforto e pela simplicidade. Toda confeccionada em algodão, a cueca Lupo possui costuras firmes e tecido macio que não incomoda a pele e protege as partes íntimas masculinas ao longo de todo o dia. Temos as melhores cuecas para seu conforto e praticidade, veja Composição: 95% Algodão, 5% Elastano",https://lupo.vteximg.com.br/arquivos/ids/187710-500-500/00784-016-2805.jpg?v=637197169085370000,https://www.lupo.com.br/cueca-lupo-am-boxer-00784-016/p,12-04-2022
Cueca Lupo Boxer Microf.,"41,90",3% poliéster 4% elastano 93% poliamida 96% poliamida,1.96,Adulto,Cuecas,Boxer,"Uma cueca masculina boxer se diferencia das demais cuecas masculinas por causa do seu design arrojado e moderno que poucas peças de roupas possuem. Para todos que preferem modelos que não sejam produzidos em algodão, a Lupo também conta com aqueles feitos em microfibra. Cuecas de microfibra absorvem melhor o suor produzido pelo corpo durante atividades físicas, reduzindo qualquer tipo de desconforto que pode surgir nos dias mais quentes. Esse modelo da Lupo atende justamente essa proposta, sendo uma das melhores escolhas de roupas íntimas masculina para o verão brasileiro. Conheça também os modelos de cueca para criança e muito mais Cor: 2920 e 8770 Composição: Poliamida 96% Elastano 4% Demais cores: Poliamida 93% Elastano 4% Poliéster 3%",https://lupo.vteximg.com.br/arquivos/ids/180908-500-500/00436-002.jpg?v=636706347088070000,https://www.lupo.com.br/cueca-lupo-boxer-microf-00436-002/p,12-04-2022
Calcinha Loba Basica,"46,90",2% algodão 5% elastano 93% poliamida,1.0,Adulto,Lingerie,Calcinhas Básica,"Toda mulher precisa daquelas roupas íntimas básicas que dão conforto e leveza ao dia a dia. E a calcinha Loba é uma dessas peças essenciais Seja para ficar mais à vontade ou para não marcar a roupa por baixo do look, essa calcinha sem costura conta com uma tecnologia moderna que permite a diminuição dos pontos de fricção, além de oferecer pontos de ventilação e tratamento contra fungos e bactérias. Características: Seamless: sem costura desenvolvida com a mais moderna tecnologia livre de costuras, diminui os pontos de fricção. Possui ainda ventilação estratégica, colocada em zonas críticas de suor. Antimicrobial tratamento de higienização que impede a proliferação de microrganismos e bactérias causadores de odores. Forro de algodão. Composição: Poliamida 93%, Elastano 5%, Algodão 2%",https://lupo.vteximg.com.br/arquivos/ids/185154-500-500/40300-001-2014.jpg?v=636892094454330000,https://www.lupo.com.br/calcinha-loba-basica-sem-costura/p,12-04-2022
Sutia Loba Top Basico,"51,90",6% elastano 94% poliamida,1.0,Adulto,Lingerie,Sutiã Top,"Composição: 94% Poliamida, 6% Elastano",https://lupo.vteximg.com.br/arquivos/ids/187392-500-500/41300-001-1110.jpg?v=637015529210430000,https://www.lupo.com.br/sutia-loba-top-basico-41300-001/p,12-04-2022
Calcinha Loba Classica -  Cotton,"38,90",8% elastano 92% algodao,1.0,Adulto,Lingerie,Calcinhas Básica,"Composição: 8% Elastano , 92% Algodao",https://lupo.vteximg.com.br/arquivos/ids/175513-500-500/97455XX.jpg?v=636459300441430000,https://www.lupo.com.br/calcinha-loba-clas-cotton-40351-001/p,12-04-2022
Meia Lupo - Walk,"16,90",19% poliamida 2% outra 79% algodão,1.0,Adulto,Meias,Esportivas,"Composição: 2% Outra Fibra, 19% Poliamida, 79% Algodão",https://lupo.vteximg.com.br/arquivos/ids/170535-500-500/03225-028-1140.jpg?v=636325257419800000,https://www.lupo.com.br/meia-lupo-au-walk-03225-028/p,12-04-2022
Blusa 2 A Pele Loba - Gola Alta,"33,90",,0.0,Adulto,Blusas,Segunda Pele,Informações: Gola Alta Composição: 85% Poliamida,https://lupo.vteximg.com.br/arquivos/ids/181795-500-500/00840-001.jpg?v=636729504015970000,https://www.lupo.com.br/blusa-2-a-pele-loba-af-gola-al-00840-001/p,12-04-2022
Cueca Lupo Slip - Micromodal Sem Costura,"48,90",,0.0,Adulto,Cuecas,Slip,"A cueca Lupo Micromodal se destaca pela sua modelagem e conforto. Seu design é mais discreto e feito com tecido micromodal, que deixa a peça ainda mais leve. Com tecnologia moderna e sem costura, a cueca da Lupo é fácil de lavar e secar e não amassa com facilidade.",https://lupo.vteximg.com.br/arquivos/ids/166369-500-500/00681-001-1110.jpg?v=636325158020600000,https://www.lupo.com.br/cueca-lupo-am-slip-s-cost-00681-001/p,12-04-2022
Cueca Lupo Boxer - Micromodal Sem Costura,"51,90",3% elastano 33% poliamida 64% modal,1.0,Adulto,Cuecas,Boxer,"Seamless Dry: Desenvolvido com a mais moderna tecnologia sem costura, diminui os pontos de fricção, possue ventilação estratégica, proporcionando alto conforto térmico. Antimicrobial: Tratamento de higienização que impede a proliferação de microrganismos e bactérias causadores de odores, Composição: 64% Modal, 33% Poliamida, 3% Elastano",https://lupo.vteximg.com.br/arquivos/ids/165387-500-500/00661-001-1110.jpg?v=636325145002170000,https://www.lupo.com.br/cueca-lupo-am-boxer-m-modal-00661-001/p,12-04-2022
Cueca Lupo Sunga - Algodão Com Elastano,"34,90",10% poliéster 5% elastano 85% algodão 95% algodão,1.95,Adulto,Cuecas,Sunga,COMPOSIÇÃO: Cor 8000: Algodão 85% Poliéster 10% Elastano 5% Demais Cores: Algodão 95% Elastano 5%,https://lupo.vteximg.com.br/arquivos/ids/164098-500-500/00480-002-8730.jpg?v=636325108858400000,https://www.lupo.com.br/cueca-lupo-am-sunga-00480-002/p,12-04-2022
Cueca Lupo Boxer,"36,90",5% elastano 95% algodão,1.0,Adulto,Cuecas,Boxer,"Composição: 95% Algodão, 5% Elastano",https://lupo.vteximg.com.br/arquivos/ids/191113-500-500/00784-021-3370.jpg?v=637467737355270000,https://www.lupo.com.br/cueca-lupo-boxer-00784-021/p,12-04-2022
Cueca Lupo Boxer,"36,90",5% elastano 95% algodão,1.0,Adulto,Cuecas,Boxer,"Composição: 95% Algodão, 5% Elastano",https://lupo.vteximg.com.br/arquivos/ids/191067-500-500/00765-003-2390.jpg?v=637467736878230000,https://www.lupo.com.br/cueca-lupo-boxer-00765-003/p,12-04-2022
Cueca Lupo Boxer - Algodão com Elastano - Kit com 10 Unidades,"310,90",10% poliéster 47% poliéster 48% algodão 5% elastano 85% algodão 95% algodão,2.9,Adulto,Cuecas,Boxer,"Uma cueca boxer de algodão consegue trazer mais conforto para o dia a dia de qualquer homem. Poucos modelos como esse da Lupo conseguem oferecer tantos benefícios para quem tem uma rotina agitada e está em vários lugares ao longo do dia. Agora imagine poder levar para casa um kit com 10 peças para renovar o seu guarda roupa e a sua coleção de roupas íntimas. Esse kit de cuecas agrada aos amantes da cueca de boxer, pois contempla diferentes cores para momentos únicos com destaque para tonalidades de branco, preto, cinza, azul e preto. Surpreenda se com esse kit que mescla tonalidades para cada momento da sua semana Composição: Cor 8001: Algodão 85%, Poliéster 10%, Elastano 5% Cor 2390: Algodão 48%, Poliéster 47%, Elastano 5% Demais cores: Algodão 95% Elastano 5%.",https://lupo.vteximg.com.br/arquivos/ids/187241-500-500/00523-900.png?v=636995914248400000,https://www.lupo.com.br/cueca-lupo-00523-936-boxer-algodao-com-elastano-kit-com-10-unidades/p,12-04-2022
Cueca Lupo Boxer,"35,90",3% poliéster 4% elastano 7% poliéster 89% poliamida 93% poliamida,1.96,Infantil,Cuecas,Boxer,Composição: Cores 5650 E 8230: Poliamida 93% Elastano 4% Poliéster 3% Demais Cores: Poliamida 89% Poliéster 7% Elastano 4%,https://lupo.vteximg.com.br/arquivos/ids/186209-500-500/00137-010-2560.jpg?v=636985591717400000,https://www.lupo.com.br/cueca-lupo-km-boxer-00137-010/p,12-04-2022
Cueca Lupo Boxer Microfibra,"30,90",3% poliéster 4% elastano 93% poliamida,1.0,Infantil,Cuecas,Boxer,Composição: 3% Poliéster 93% Poliamida 4% Elastano,https://lupo.vteximg.com.br/arquivos/ids/186194-500-500/00132-002-1120.jpg?v=636985591587600000,https://www.lupo.com.br/cueca-lupo-km-boxer-microf-00132-002/p,12-04-2022
Meia Lupo Sport - Kit com 10 Pares,"137,90",1% outra 34% poliamida 65% algodão,1.0,Adulto,Meias,Esportivas,"Calcanhar Verdadeiro Atoalhada Composição: 65% Algodão, 34% Poliamida, 1% Outra Fibra",https://lupo.vteximg.com.br/arquivos/ids/185751-500-500/03245-9100900.png?v=636924862521030000,https://www.lupo.com.br/meia--lupo-kit-com-10-unidades-03245-910/p,12-04-2022
Meia Lupo Sport Sapatilha,"15,90",3% outra 30% poliamida 67% algodão,1.0,Adulto,Meias,Esportivas,"Composição: 3% Outra Fibra, 30% Poliamida, 67% Algodão",https://lupo.vteximg.com.br/arquivos/ids/182958-500-500/03270-062-1230.jpg?v=636868938353330000,https://www.lupo.com.br/meia-lupo-au-sport-sap-03270-062/p,12-04-2022
Meia Lupo Sport,"18,90",20% poliamida 3% outra 77% algodão,1.0,Adulto,Meias,Esportivas,Composição: 77% Algodão 20% Poliamida 3% Outra Fibra,https://lupo.vteximg.com.br/arquivos/ids/182941-500-500/03290-114-1120.jpg?v=636868938150770000,https://www.lupo.com.br/meia-lupo-am-sport-03290-114/p,12-04-2022
Meia Lupo Sapatilha,"12,90",3% outra 31% poliamida 66% algodão,1.0,Adulto,Meias,Soquetes,Composição: 66% Algodão 31% Poliamida 3% Outra Fibra,https://lupo.vteximg.com.br/arquivos/ids/185898-500-500/04270-002-1110.jpg?v=636985589221430000,https://www.lupo.com.br/meia-lupo-af-sapatilha-04270-002/p,12-04-2022
Meia - Calça Loba Opaca Fio 80,"36,90",6% elastano 94% poliamida,1.0,Adulto,Meias-Calças,Fashion,"Composição: 94% Poliamida , 6% Elastano",https://lupo.vteximg.com.br/arquivos/ids/181034-500-500/05858-001.jpg?v=636709670077400000,https://www.lupo.com.br/meia-calca-loba-opaca-fio-80-05858-001/p,12-04-2022
Sutia Loba Angel,"51,90",6% elastano 94% poliamida,1.0,Adulto,Lingerie,Sutiã Básico,sutia loba af angel sem costura antimicrobial composição: poliamida 94% elastano 6%,https://lupo.vteximg.com.br/arquivos/ids/167392-500-500/41260-003-9990.jpg?v=636325180476130000,https://www.lupo.com.br/sutia-loba-af-angel-41260-003/p,12-04-2022
Sutia Loba Power,"84,90",7% elastano 93% poliamida,1.0,Adulto,Lingerie,Sutiã Básico,"Composição: 93%, Poliamida, 7%, Elastano",https://lupo.vteximg.com.br/arquivos/ids/166882-500-500/41028-001-9990.jpg?v=636325167574430000,https://www.lupo.com.br/sutia-loba-power-41028-001/p,12-04-2022
Calcinha Loba Calecon,"46,90",2% algodão 5% elastano 93% poliamida,1.0,Adulto,Lingerie,Calcinhas Caleçon,"Poucas peças íntimas femininas surpreendem tanto quanto a calcinha loba . Ao contrário das demais calcinhas femininas , essa peça se destaca pela forma como se adapta ao corpo, sem deixar marcas ou causar incômodos em contato direto com a pele. A calcinha lupo loba surge como uma alternativa para os dias que você procura por mais conforto sem sacrificar o look. Composição: 93% Poliamida, 5% Elastano, 2% Algodão",https://lupo.vteximg.com.br/arquivos/ids/166594-500-500/40900-001-9990.jpg?v=636325161007530000,https://www.lupo.com.br/calcinha-loba-af-calecon-40900-001/p,12-04-2022
Calcinha Loba Fio Dental,"40,90",2% algodão 5% elastano 93% poliamida,1.0,Adulto,Lingerie,Calcinhas Fio Dental,"Composição: 93% Poliamida, 5% Elastano, 2% Algodão",https://lupo.vteximg.com.br/arquivos/ids/185240-500-500/40600-001-B.jpg?v=636893080227170000,https://www.lupo.com.br/calcinha-loba-af-f-dental-bas-40600-001/p,12-04-2022
Calcinha Loba Tanga Basica,"41,90",2% algodão 5% elastano 93% poliamida,1.0,Adulto,Lingerie,Calcinhas Tanga,"Uma calcinha loba desperta o instinto mais selvagem e independente de uma mulher ao mesmo tempo em que garante o conforto e a segurança que ela precisa para o curtir o dia a dia. Esse modelo desenvolvido pela Lupo oferece isso e muito mais. Toda confeccionada em algodão, elastano e poliamida, essa calcinha feminina é macia, elástica e resistente. Está disponível em diversas cores e tamanhos para combinar com o seu estilo. Composição: 93% Poliamida, 5% Elastano, 2% Algodão",https://lupo.vteximg.com.br/arquivos/ids/166460-500-500/40500-001-5730.jpg?v=636325159118230000,https://www.lupo.com.br/calcinha-loba-af-tanga-basica-40500-001/p,12-04-2022
Calcinha Loba  Tanga Cotton,"35,90",8% elastano 92% algodao,1.0,Adulto,Lingerie,Calcinhas Tanga,"Composição: 8% Elastano, 92% Algodao",https://lupo.vteximg.com.br/arquivos/ids/175516-500-500/97544XX.jpg?v=636459305626000000,https://www.lupo.com.br/calcinha-loba-af-tanga-cotton-40354-001/p,12-04-2022
Calcinha Loba Biquini  - Cotton,"35,90",8% elastano 92% algodão,1.0,Adulto,Lingerie,Calcinhas Biquini,"Dê um toque de delicadeza e conforto para o seu dia a dia com a calcinha loba. Feita para em algodão e elastano, ela se ajusta perfeitamente ao corpo, sem marcar a pele ou a roupa que ficará por cima. Outro motivo para investir nessa calcinha biquíni é o caimento perfeito que ela tem no corpo, graças à presença do elastano e do algodão. E por falar nesses dois tecidos, eles foram a peça ideal para qualquer momento. Composição: 8% Elastano, 92% Algodão",https://lupo.vteximg.com.br/arquivos/ids/175515-500-500/97511XX.jpg?v=636459304238700000,https://www.lupo.com.br/calcinha-loba-af-biquini-cotton-40353-001/p,12-04-2022
Calcinha Loba Basica -  Cotton,"38,90",8% elastano 92% algodão,1.0,Adulto,Lingerie,Calcinhas Básica,"Composição: 8% Elastano, 92% Algodão",https://lupo.vteximg.com.br/arquivos/ids/175514-500-500/97487XX.jpg?v=636459302689970000,https://www.lupo.com.br/calcinha-loba-af-bas-cotton-40352-001/p,12-04-2022
Calcinha Loba Classica Sem Costura,"48,90",5% e,0.05,Adulto,Lingerie,Calcinhas Biquini,"Com toques de algodão, 93% de poliamida e 5% de elastano, a Lupo criou uma calcinha sem costura que, além de ser sexy e clássica, diminui os pontos de fricção em contato com a pele, tornando esta peça muito confortável de ser usada. Lindo e delicado, este produto ganhará, com certeza, um lugar especial no seu guarda roupa. A calcinha sem costura Lupo conta também com um sistema de ventilação estratégica, permitindo a respiração da pele em zonas críticas de suor. Além disso, é feita com tecnologia antimicrobial, ou seja, impede a proliferação de microrganismos que causam maus odores. Qual cor é a sua preferida Confira as nossas opções",https://lupo.vteximg.com.br/arquivos/ids/175512-500-500/97218XX.jpg?v=636459298773830000,https://www.lupo.com.br/calcinha-loba-af-classica-40310-001/p,12-04-2022
Meia Calça Loba Opaca Fio 40,"29,90",,0.0,Adulto,Meias-Calças,Opaca,"A meia calça Loba Opaca fio 40 é ideal para todas as ocasiões. Seja à mostra, por baixo de uma saia ou de baixo de outra peça, a meia calça Lupo te mantém sempre elegante e aquecida. Sua composição possui elastano que dá maior flexibilidade e permite que você aproveite todos os momentos com maior liberdade.",https://lupo.vteximg.com.br/arquivos/ids/172524-500-500/05830-001-2300.jpg?v=636325296255700000,https://www.lupo.com.br/meia-calca-loba-af-opaca-05830-001/p,12-04-2022
Meia Calça Loba Classica Fina Fio 15,"15,90",,0.0,Adulto,Meias-Calças,Fina,Composição: 85% Poliamida Fio 15,https://lupo.vteximg.com.br/arquivos/ids/181776-500-500/05760-001.jpg?v=636729432030200000,https://www.lupo.com.br/meia-calca-loba-af-clas-fina-05760-001/p,12-04-2022
Meia Sapatilha Lupo Adulto,"21,90",29% poliamida 3% outra 68% algodao,1.0,Adulto,Meias,Soquetes,"Composição: 3% Outra Fibra , 29% Poliamida , 68% Algodao",https://lupo.vteximg.com.br/arquivos/ids/171073-500-500/03282-001-1120.jpg?v=636325268168600000,https://www.lupo.com.br/meia-lupo-am-sapatilha-03282-001/p,12-04-2022
Meia Lupo Sport Kit3 - Kit com 3 Pares,"43,90",3% outra 30% poliamida 67% algodão,1.0,Adulto,Meias,Esportivas,"Composição: 67% ALGODÃO, 30% Poliamida, 3% Outra Fibra",https://lupo.vteximg.com.br/arquivos/ids/170901-500-500/03270-089-0906.jpg?v=636325265260930000,https://www.lupo.com.br/meia-lupo-au-sport-kit3-03270-089/p,12-04-2022
Meia Sapatilha Lupo -  Sport,"15,90",3% outra 30% poliamida 67% algodão,1.0,Adulto,Meias,Soquetes,"A Meia Sapatilha Lupo já se tornou um item básico, tanto para quem pratica atividades físicas quanto para quem deseja apenas esconder o detalhe da meia no sapato. Super confortáveis, estão disponíveis em diversas cores e possuem em sua composição poliamida e algodão. As Meias Lupo são uma excelente opção para quem não abre mão de aliar estilo e conforto na hora de cuidar dos pés. Composição: 3% Outra Fibra, 30% Poliamida, 67% Algodão",https://lupo.vteximg.com.br/arquivos/ids/170813-500-500/03270-001-8020.jpg?v=636325263158630000,https://www.lupo.com.br/meia-lupo-au-sport-sap-03270-001/p,12-04-2022
Blusa 2 A Pele Loba - Manga Longa,"34,90",,0.0,Adulto,Blusas,Segunda Pele,Informações: Manga Longa Fio 40 Composição: 85% Poliamida,https://lupo.vteximg.com.br/arquivos/ids/182313-500-500/00800-001-1000.jpg?v=636867965703500000,https://www.lupo.com.br/blusa-2-a-pele-loba-00800-001/p,12-04-2022
Cueca Lupo Boxer,"51,90",4% elastano 5% elastano 7% poliéster 86% poliamida 9% poliamida 9% poliester,1.2,Adulto,Cuecas,Boxer,"Se você ainda não teve o prazer de usar uma cueca sem costura , não sabe o que está perdendo. Com fio texturizado a ar, essa cueca dura mais tempo, além de proporcionar conforto sem igual, graças à sensação macia e reconfortante do algodão que dá forma ao modelo. Por sua vez, a tecnologia e resistência do nylon impede que o tecido se rompa, seja no dia a dia ou após as lavagens. A presença da poliamida, do poliéster e do elastano tornam essa cueca boxer Lupo flexível, leve e confortável para o dia a dia. Garanta logo a sua A nossa categoria Lupo Sport está repleta de novidades e produtos super tecnológicos, não deixe de conferir Informações: Fio texturizado a ar Sensação de algodão com a tecnologia e resistência do nylon Composição: Cor 9990 Preta: Poliamida 86% Poliester 9% Elastano 5% Demais cores: Poliamida 9% Poliéster 7% Elastano 4%",https://lupo.vteximg.com.br/arquivos/ids/166756-500-500/00733-004-2560.jpg?v=636325164260100000,https://www.lupo.com.br/cueca-lupo-am-boxer-00733-004/p,12-04-2022
Cueca Lupo Slip - Microfibra,"43,90",3% poliester 4% elastano 93% poliamida 96% poliamida,1.96,Adulto,Cuecas,Slip,"Muitos homens não conseguem se acostumar com cuecas boxer e acabam fazendo questão de usar os modelos slip que não cobrem as pernas e dão mais mobilidade no dia a dia. Feita de poliamida e elastano, a cueca slip lupo não marca as pernas quando é usada com calça jeans, oferece conforto de sobra para ficar de bobeira em casa ou praticar exercícios dentro e fora de casa. O que você está esperando para garantir logo a sua próxima cueca slip preta e renovar a sua coleção de roupas íntimas Composição: Cores 4530 5650: Poliamida 96% Elastano 4% Demais cores: Poliamida 93% Elastano 4% Poliester 3%",https://lupo.vteximg.com.br/arquivos/ids/166585-500-500/00691-002-1110.jpg?v=636325160910400000,https://www.lupo.com.br/cueca-lupo-am-slip-microf-00691-002/p,12-04-2022
Cueca Lupo Boxer - Microfibra,"45,90",3% poliéster 4% elastano 93% poliamida 96% poliamida,1.96,Adulto,Cuecas,Boxer,"Quando falamos sobre excelência em roupa íntima masculina, estamos nos referindo à Cueca Lupo Boxer Microfibra Sem Costura Nos últimos anos, a cueca boxer ganhou lugar garantido na rotina de homens apaixonados por cuecas práticas e modernas, feitas para que fiquem confortáveis em diversas situações. Este modelo de cueca sem costura foi produzido com as melhores malhas do mercado, possibilitando uma maior liberdade de movimentos. A presença da poliamida e do elastano e com a tecnologia da microfibra, você estará adquirindo uma peça durável, leve e fácil de lavar e secar. Valorize o seu corpo e as suas curvas. Invista em uma cueca boxer de microfibra que te acompanha em todos os momentos. Composição: Cores 3250 4530 8710 5650: Poliamida 96% Elastano 4% Demais cores: Poliamida 93% Elastano 4% Poliéster 3%",https://lupo.vteximg.com.br/arquivos/ids/165925-500-500/00671-002-1110.jpg?v=636325151430570000,https://www.lupo.com.br/cueca-lupo-am-boxer-microf-00671-002/p,12-04-2022
Cueca Lupo Slip,"48,90",3% poliester 4% elastano 7% poliester 89% poliamida 93% poliamida,1.96,Adulto,Cuecas,Slip,"Há anos que a cueca slip masculina ganhou espaço no dia a dia dos homens. Ela protege os genitais, não incomoda quando é usada com calça jeans, favorece a prática de esportes, enfim, conta com inúmeros benefícios que deixam o seu dia mais confortável. Esse modelo da Lupo oferece tudo isso e muito mais para você aproveitar todos os momentos com o máximo conforto e flexibilidade. Fio texturizado a ar. Sensação de algodão com a tecnologia e resistência do nylon COMPOSIÇÃO: Cores 5650 8230: Poliamida 93% Elastano 4% Poliester 3% Demais cores: Poliamida 89% Poliester 7% Elastano 4%",https://lupo.vteximg.com.br/arquivos/ids/165111-500-500/00624-003-2560.jpg?v=636325139543830000,https://www.lupo.com.br/cueca-lupo-am-slip-00624-003/p,12-04-2022
