name,price,composition,material-sum,age,category,sub_category,description,img_url,url,scrapped-at
Calcinha Lobinha Básica - Kit com 2 Unidades,"20,90",100% algodao,1.0,Infantil,Lingerie,Calcinhas Básica,Composição: 100% Algodao,https://lupo.vteximg.com.br/arquivos/ids/177698-500-500/00238-088-kit900-2550.jpg?v=636572262226530000,https://www.lupo.com.br/calcinha-lobinha-basica-kit-com-2-00238-088/p,12-04-2022
Calca Lupo Capri Arrastao,"146,90",4% elastano 96% poliamida,1.0,Adulto,Lupo Sport,Calças,"Composição: 96% Poliamida, 4% Elastano",https://lupo.vteximg.com.br/arquivos/ids/192573-500-500/71583-001-9990.png?v=637626391189100000,https://www.lupo.com.br/calca-lupo-af-capri-arrastao/p,12-04-2022
Cinta Loba Af Short Skin,"93,90",18% elastano 2% algodao 80% poliamida,1.0,Adulto,Atributos,Bermuda/Short Slim,"Composição: 80% Poliamida , 18% Elastano , 2% Algodao",https://lupo.vteximg.com.br/arquivos/ids/182394-500-500/47124-001-6140.jpg?v=636868929025900000,https://www.lupo.com.br/cinta-loba-af-short-skin/p,12-04-2022
Meia Lupo Af,"15,90",21% poliamida 3% outra 76% algodao,1.0,Adulto,Meias,Soquetes,"Composição: 3% Outra Fibra, 21% Poliamida, 76% Algodao",https://lupo.vteximg.com.br/arquivos/ids/185849-500-500/04535-159-1120.jpg?v=636985588833900000,https://www.lupo.com.br/meia-lupo-af/p,12-04-2022
Meia Lupo Sapatilha  Pilates,"28,90",16% poliamida 3% outra 81% algodão,1.0,Adulto,Meias,Esportivas,"Composição: 3% Outra Fibra, 16% Poliamida, 81% Algodão",https://lupo.vteximg.com.br/arquivos/ids/182388-500-500/03286-002-5700.jpg?v=636868928960500000,https://www.lupo.com.br/meia-lupo-af-sap--pilates/p,12-04-2022
Cueca Lupo Slip Kit com 2 Unidades,"58,90",10% poliester 5% elastano 85% algodão 95% algodão,1.95,Adulto,Cuecas,Slip,COMPOSIÇÃO: Cor 8000: Algodão 85% Poliester 10% Elastano 5% Demais Cores: Algodão 95% Elastano 5%,https://lupo.vteximg.com.br/arquivos/ids/176434-500-500/00524-088.jpg?v=636536199334200000,https://www.lupo.com.br/cueca-lupo-am-slip-kit2/p,12-04-2022
Blusa 2 A Pele Lobinha,"28,90",,0.0,Infantil,Blusas,Segunda Pele,composição: 85% poliamida,https://lupo.vteximg.com.br/arquivos/ids/187290-500-500/00860-001-1000.jpg?v=637001965813370000,https://www.lupo.com.br/blusa-2-a-pele-lobinha-00860-001/p,12-04-2022
Short Lupo Moletom,"166,90",3% elastano 97% algodão,1.0,Adulto,Lupo Sport,Shorts,"Se tem um tecido perfeito no mundo da moda, com certeza é o Moletom Por isso, não poderíamos perder a oportunidade de criar um shorts de moletom do jeito que só a Lupo sabe fazer O Short Lupo Masculino Moletom foi criado para homens que amam conforto, mas não abrem mão de design. O Short Lupo Moletom conta com 97% de algodão e 3% de elastano, garantindo um caimento perfeito e uma elasticidade ideal para corridas e, até mesmo, outras práticas esportivas. Escolha a sua cor, confira nossas medidas e garanta agora mesmo este shorts de moletom da Lupo Composição: 97% Algodão, 3% Elastano",https://lupo.vteximg.com.br/arquivos/ids/192566-500-500/76351-001-8780.jpg?v=637626372757600000,https://www.lupo.com.br/short-lupo-am-moletom-76351-001/p,12-04-2022
Short Lupo M Runner,"122,90",100% poliester,1.0,Adulto,Lupo Sport,Shorts,Composição: 100% Poliester,https://lupo.vteximg.com.br/arquivos/ids/171802-500-500/76350-001-9990.jpg?v=636325283316170000,https://www.lupo.com.br/short-lupo-am-m-runner-76350-001/p,12-04-2022
T-Shirt Lupo Basic Masculina,"71,90",,0.0,Adulto,Lupo Sport,Camisetas,"camiseta lupo am basica DRY: Alta tecnologia em absorção do suor, proporcionando maior conforto térmico. composição: poliéster 100%",https://lupo.vteximg.com.br/arquivos/ids/188762-500-500/75040-001-1110.jpg?v=637197181223030000,https://www.lupo.com.br/camiseta-lupo-am-basica-75040-001/p,12-04-2022
T-Shirt Lupo Warm Feminina,"194,90",4% elastano 96% poliamida,1.0,Adulto,Lupo Sport,Camisetas,"Camiseta Lupo Under Warm Produtos Warm promovem isolamento térmico, mantendo a temperatura corporal e retardando a troca de calor com o ambiente externo. indicado para uso underwear, associado a produtos mais espessos e com ação bloqueadora do vento, isto é, o produto warm deve ser a camada mais próxima a pele e para garantir maior conforto possui propriedades bacteriostáticas, neutraliza odores e tem excelente absorção e gerenciamento de umidade. SEAMLESS DRY: SEM COSTURA desenvolvido com a mais moderna tecnologia sem costura, diminui os pontos de fricção. Possui ventilação estratégica, colocada em zonas críticas de suor, proporcionando alto conforto térmico. ANTIMICROBIAL tratamento de higienização que impede a proliferação de microrganismos e bactérias causadores de odores. ISOLAMENTO TÉRMICO produto desenvolvido com material especial que mantém a temperatura corporal e retarda a troca de calor com ambiente externo. FIO HEAT fio desenvolvido com aditivo de cascas de café carbonizadas que, através da Nanotecnologia, resultam em um componente que retém o calor natural do corpo e retarda a perda de temperatura que ocorre naturalmente em temperaturas externas baixas. O isolamento térmico é ainda mais eficaz quando o fio é usado em uma camada mais próxima ao corpo, como uma segunda pele . A fibra oferece ainda propriedades bacteriostáticas, efeito desodorizante e uma sensação livre de suor, através de gerenciamento de umidade. Promove máximo conforto e desempenho durante todo o dia. Composição: poliamida 96% elastano 4%",https://lupo.vteximg.com.br/arquivos/ids/188711-500-500/71633-001-9990.jpg?v=637197180964670000,https://www.lupo.com.br/camiseta-lupo-af-under-warm-71633-001/p,12-04-2022
Top Lupo Attack II,"102,90",7% elastano 93% poliamida,1.0,Adulto,Lupo Sport,Top,"O top Lupo Sport Attack II foi pensado e desenvolvido para tornar a prática de atividades físicas de alta performance mais confortáveis e seguras. Sua modelagem especial possui costas estilo nadador com decote arredondado, busto anatômico duplo, para maior conforto e sustentação, além de decote e cavas com acabamento em viés. Confeccionado em microfibra dupla sem costura, o top feminino Lupo é perfeito para acompanhar qualquer rotina de bem estar e conforto. Disponível em diversas cores, sua grade de tamanho abrange diversas numerações, indo do PP até o GG. Composição: 93% Poliamida, 7% Elastano",https://lupo.vteximg.com.br/arquivos/ids/179016-500-500/71401-001-9990.jpg?v=636658620653500000,https://www.lupo.com.br/top-lupo-attack-ii-71401-001/p,12-04-2022
Bermuda Lupo Feminina Termica Emana,"105,90",4% elastano 96% poliamida,1.0,Adulto,Lupo Sport,Bermudas,"Informações: Conforto térmico, estabilizando a temperatura corporal durante práticas esportiva Antimicrobial Produto desenvolvido com diferentes níveis de compressão que melhoram o contrapeso do músculo e a postua corporal Composição: 96% Poliamida 4% Elastano",https://lupo.vteximg.com.br/arquivos/ids/192878-500-500/71055-001-9990.jpg?v=637808236792700000,https://www.lupo.com.br/bermuda-lupo-af-term-emana-71055-001/p,12-04-2022
Calça Lupo Masculina Underwear Warm,"161,90",4% elastano 96% poliamida,1.0,Adulto,Lupo Sport,Calças,"calca lupo am under warm produtos warm promovem isolamento térmico, mantendo a temperatura corporal e retardando a troca de calor com o ambiente externo. indicado para uso underwear, associado a produtos mais espessos e com ação, bloqueadora do vento, isto é, o produto warm deve ser a camada mais próxima a pele e para garantir maior conforto possui propriedades bacteriostáticas, neutraliza odores e tem excelente absorção e gerenciamento de umidade. seamless dry: sem costura desenvolvido com a mais moderna tecnologia sem costura, diminui os pontos de fricção. possui ventilação estratégica, colocada em zonas críticas de suor, proporcionando alto conforto térmico. composição: poliamida 96% elastano 4%",https://lupo.vteximg.com.br/arquivos/ids/189206-500-500/70054-001-9990.jpg?v=637255790572430000,https://www.lupo.com.br/calca-lupo-am-under-warm-70054-001/p,12-04-2022
Regata Lupo Masculina Térmica Run,"114,90",7% elastano 93% poliamida,1.0,Adulto,Lupo Sport,Camisetas,"Camiseta Lupo Termica Run Produtos térmicos promovem conforto térmico, estabilizando a temperatura corporal durante práticas esportivas. SEAMLESS DRY: SEM COSTURA desenvolvido com a mais moderna tecnologia sem costura, diminui os pontos de fricção. Possui ventilação estratégica, colocada em zonas críticas de suor, proporcionando alto conforto térmico. ANTIMICROBIAL tratamento de higienização que impede a proliferação de microrganismos e bactérias causadores de odores. HIGH COMPRESSION: SEM COSTURA produto desenvolvido com diferentes níveis de compressão que melhoram o contrapeso do músculo e a postura corporal. Composição: poliamida 93% elastano 7%",https://lupo.vteximg.com.br/arquivos/ids/188656-500-500/70030-001-1110.jpg?v=637197180678970000,https://www.lupo.com.br/camiseta-lupo-am-termica-run-70030-001/p,12-04-2022
Camiseta Lupo Regata,"126,90",100% poliamida,1.0,Adulto,Outlet,Camisetas,"A camiseta regata masculina Lupo Uv50 é confeccionada em microfibra macia e fria, proporcionando equilíbrio da temperatura corporal e proteção contra os raios UV. Desenvolvida com modelagem que proporciona maior liberdade de movimento e conforto durante a prática de atividades físicas e corridas. A regata masculina Lupo não possui costuras e conta com ventilação estratégica, para aumentar o conforto térmico. Além disso, possui tratamento antimicrobiano, que impede a proliferação de micro organismos causadores de odores e bactérias. Composição: 100% Poliamida",https://lupo.vteximg.com.br/arquivos/ids/185216-500-500/70000-001-9990.jpg?v=636892958738930000,https://www.lupo.com.br/camiseta-lupo-regata-70000-001/p,12-04-2022
Sutia Loba Control Top,"84,90",6% elastano 94% poliamida,1.0,Adulto,Atributos,Top Slim,"Composição: 94%, Poliamida, 6%, Elastano",https://lupo.vteximg.com.br/arquivos/ids/176479-500-500/LUPO-LINGERIE-611242.jpg?v=636536229608300000,https://www.lupo.com.br/sutia-loba-control-top-47180-001/p,12-04-2022
Body Loba Slim,"157,90",12% elastano 2% algodão 86% poliamida,1.0,Adulto,Atributos,Body Slim,body loba af slim body de compressão diminui e modela fecho entre as pernas afina a cintura sem bojo e sem aro composição: poliamida 86% elastano 12% algodão 2%,https://lupo.vteximg.com.br/arquivos/ids/180083-500-500/LUPO-LINGERIE-611551.jpg?v=636688174885730000,https://www.lupo.com.br/body-loba-af-slim-47150-001/p,12-04-2022
Blusa Loba Gola Alta,"131,90",6% elastano 94% poliamida,1.0,Adulto,Blusas,Blusa,blusa loba af gola alta sem costura antimicrobial composição: poliamida 94% elastano 6%,https://lupo.vteximg.com.br/arquivos/ids/168284-500-500/45100-001-8870.jpg?v=636325200615500000,https://www.lupo.com.br/blusa-loba-af-gola-alta-45100-001/p,12-04-2022
Sutiã Loba Cotton Renda Bojo Removível,"129,90",8% elastano 92% algodao,1.0,Adulto,Lingerie,Sutiã Básico,"Composição: 8% Elastano, 92% Algodao",https://lupo.vteximg.com.br/arquivos/ids/174609-500-500/42004-001-3070.jpg?v=636408402238630000,https://www.lupo.com.br/sutia-loba-af-c-renda-42004-001/p,12-04-2022
Calcinha Loba Redutora Fio Dental Slim,"86,90",2% algodao 5% elastano 93% poliamida,1.0,Adulto,Atributos,Calcinha Redutora Slim,"Composição: 93% Poliamida , 5% Elastano , 2% Algodao",https://lupo.vteximg.com.br/arquivos/ids/167207-500-500/41055-001-9990.jpg?v=636325175259370000,https://www.lupo.com.br/calcinha-loba-af-redut-fio-d-41055-001/p,12-04-2022
Calcinha Loba Sunga Basica,"43,90",2% algodão 5% elastano 93% poliamida,1.0,Adulto,Lingerie,Calcinhas Sunga,"Calcinhas bo nitas e resistentes não são fáceis de encontrar por aí, mas na Lupo elas tem presença garantida. A calcinha Lupo loba , por exemplo, tem design ousado e é feita com materiais selecionados à dedo. A tecnologia empregada na confecção dessa calcinha feminina já demonstra o tratamento que ela recebeu para te proporcionar o máximo de conforto possível. Não existem costuras que possam incomodar a pele e a ventilação é estratégica, justamente para controlar o suor produzido próximo das partes íntimas. forro de algodão composição: poliamida 93% elastano 5% algodão 2%",https://lupo.vteximg.com.br/arquivos/ids/185248-500-500/40450-001-A.jpg?v=636893114599070000,https://www.lupo.com.br/calcinha-loba-af-sunga-basica-40450-001/p,12-04-2022
Meia Lupo Alien - Brilha no Escuro,"42,90",2% elastano 25% poliamida 73% algodão,1.0,Adulto,Meias,Urban,SILK QUE BRILHA NO ESCURO COMPOSIÇÃO: 73% ALGODÃO COTTON 25% POLIAMIDA 2% ELASTANO,https://lupo.vteximg.com.br/arquivos/ids/181763-500-500/16901-002.jpg?v=636728857226570000,https://www.lupo.com.br/meia-lupo-au-urban-16901-002/p,12-04-2022
Calça Loba Montaria,"168,90",14% elastano 86% poliamida,1.0,Adulto,Meias-Calças,Legging,"Composição: 86% Poliamida , 14% Elastano",https://lupo.vteximg.com.br/arquivos/ids/178790-500-500/LUPO-DIA-3-MEIA-CALCA6394-copy.jpg?v=636615643919370000,https://www.lupo.com.br/calca-loba-af-leg-montar-05857-001/p,12-04-2022
Meia Calça Loba Opaca Plus Fio 40,"42,90",8% elastano 92% poliamida,1.0,Adulto,Meias-Calças,Opaca,"Composição: 92% Poliamida, 8% Elastano Fio 40",https://lupo.vteximg.com.br/arquivos/ids/180077-500-500/05837-001.jpg?v=636688159787770000,https://www.lupo.com.br/meia-calca-loba-af-opaca-plus-05837-001/p,12-04-2022
Meia Calça Loba Trico Fio 70,"41,90",6% elastano 94% poliamida,1.0,Adulto,Meias-Calças,Fashion,"Composição: 94% Poliamida , 6% Elastano",https://lupo.vteximg.com.br/arquivos/ids/172493-500-500/05821-001-6970.jpg?v=636325295734230000,https://www.lupo.com.br/meia-calca-loba-af-trico-05821-001/p,12-04-2022
MeiaCalca Loba Dedos Livre,"18,90",,0.0,Adulto,Meias-Calças,Fina,Composição: 85% Poliamida No Minimo,https://lupo.vteximg.com.br/arquivos/ids/181782-500-500/05765-001.jpg?v=636729449807330000,https://www.lupo.com.br/meia-calca-loba-af-dedos-livre-05765-001/p,12-04-2022
Short Lupo Emana,"67,90",12% elastano 88% poliamida,1.0,Adulto,Atributos,Bermuda/Short Slim,"Composição: 88% Poliamida , 12% Elastano",https://lupo.vteximg.com.br/arquivos/ids/180104-500-500/05691-001.jpg?v=636688210472170000,https://www.lupo.com.br/cinta-short-lupo-af-emana-05691-001/p,12-04-2022
Cinta Short Loba  Slim - Com Abertura,"61,90",12% elastano 88% poliamida,1.0,Adulto,Atributos,Bermuda/Short Slim,"Composição: 88% Poliamida , 12% Elastano",https://lupo.vteximg.com.br/arquivos/ids/179185-500-500/05694-001.jpg?v=636679551930330000,https://www.lupo.com.br/cinta-short-loba-af-slim-abert-05694-001/p,12-04-2022
Meia 3/4 Acrilico Fio 80 Loba  - Tamanho: U | Cor: Preto | Calçados: De 34 a 39,"28,90",29% poliamida 3% elastano 68% acrílico,1.0,Adulto,Meias,Clássicas,"Composição: 68% Acrílico, 29% Poliamida, 3% Elastano Fio 80",https://lupo.vteximg.com.br/arquivos/ids/176573-500-500/LUPO-DIA-3-MEIA-CALCA6481-copy.jpg?v=636536788056270000,https://www.lupo.com.br/meia-3-4-loba-mini-lu-af-acrilico-05538-001/p,12-04-2022
Meia Loba Arrastão  - Tamanho: U | Cor: Preto | Calçados: 34 a 39,"14,90",9% elastano 91% poliamida,1.0,Adulto,Meias,Soquetes,"Composição: 91% Poliamida , 9% Elastano",https://lupo.vteximg.com.br/arquivos/ids/176422-500-500/LUPO-DIA-3-MEIA-CALCA6527-copy.jpg?v=636536093716500000,https://www.lupo.com.br/meia-loba-af-soq-arrast-05533-001/p,12-04-2022
Meia Loba Sapatilha - Fio 40 - 2 Pares  - Tamanho: U | Cor: Po De Arroz | Calçados: 34 a 39,"9,90",2% elastano 98% poliamida,1.0,Adulto,Meias,Soquetes,"Composição: 98% Poliamida, 2% Elastano Fio 40",https://lupo.vteximg.com.br/arquivos/ids/172126-500-500/05520-001-6540.jpg?v=636325289271200000,https://www.lupo.com.br/meia-loba-af-sapatilha-k2-05520-001/p,12-04-2022
Meia Loba MiniLu AF,"9,90",,0.0,Adulto,Meias,Soquetes,Composição: 85% Poliamida Fio 20,https://lupo.vteximg.com.br/arquivos/ids/172120-500-500/05510-001-2930.jpg?v=636325289184130000,https://www.lupo.com.br/meia-loba-mini-lu-af-05510-001/p,12-04-2022
Meia Calça Loba Fh Arrastão,"48,90",9% elastano 91% poliamida,1.0,Adulto,Meias-Calças,Fashion,"A Meia Calça Loba Fh Arrastão foi feita pensando nas mulheres decididas, que sabem o que querem e percorrem qualquer distância para alcançar seus objetivos. Com 91% de poliamida e 9% de elastano, esta meia arrastão possibilita uma maior elasticidade e um caimento perfeito. Ressaltando as suas curvas, a meia arrastão Lupo é um grande complemento para o seu look, sendo a peça que faltava para você arrasar onde quer que você vá Este produto Lupo é perfeito para expressar sua força de vontade Vamos de Lupo hoje Composição: 91%, Poliamida, 9%, Elastano",https://lupo.vteximg.com.br/arquivos/ids/184649-500-500/05095-001.jpg?v=636876485633500000,https://www.lupo.com.br/meia-calca-loba-fh-arrastao-05095-001/p,12-04-2022
Meia Lupo Adulto - Kit C/ 3 Unidades,"40,90",2% outra 38% poliamida 60% algodao,1.0,Adulto,Meias,Soquetes,"Composição: 2% Outra Fibra , 38% Poliamida , 60% Algodao",https://lupo.vteximg.com.br/arquivos/ids/171322-500-500/04200-089-0900.jpg?v=636325273880770000,https://www.lupo.com.br/meia-lupo-af-basic-kit3-04200-089/p,12-04-2022
Meia Sapatilha Lupo - Kit C/ 3 Unidades,"36,90",3% outra 31% poliamida 66% algodão,1.0,Adulto,Meias,Soquetes,Composição: 31% Poliamida 3% Outra Fibra 66% Algodão,https://lupo.vteximg.com.br/arquivos/ids/173779-500-500/03310-002-1110.jpg?v=636344312284730000,https://www.lupo.com.br/meia-lupo-af-sap-kit3-04270-089/p,12-04-2022
Meia Lupo Adulto - Walk,"18,90",28% poliamida 4% outras 68% algodão,1.0,Adulto,Meias,Esportivas,composição: 68% algodão cotton 28% poliamida 4% outras fibras,https://lupo.vteximg.com.br/arquivos/ids/171146-500-500/03290-009-1110.jpg?v=636325269625230000,https://www.lupo.com.br/meia-lupo-am-walk-03290-009/p,12-04-2022
Meia Lupo Classica,"19,90",100% poliamida,1.0,Adulto,Meias,Clássicas,Composição: 100% Poliamida,https://lupo.vteximg.com.br/arquivos/ids/175096-500-500/03100-001_KIT_COR_001.jpg?v=636437508898930000,https://www.lupo.com.br/meia-lupo-tm-classica-03100-001/p,12-04-2022
Meia Lupo Infantil,"12,90",27% poliamida 3% outra 70% algodao,1.0,Infantil,Meias,Soquetes,"Composição: 3% Outra Fibra , 27% Poliamida , 70% Algodao",https://lupo.vteximg.com.br/arquivos/ids/170371-500-500/02835-002-9990.jpg?v=636325253860230000,https://www.lupo.com.br/meia-lupo-ku-02835-002/p,12-04-2022
Meia Lupo Infantil,"13,90",22% poliamida 3% outra 75% algodão,1.0,Infantil,Meias,Soquetes,"Composição: 75% Algodão, 22% Poliamida, 3% Outra Fibra Cano 8cm",https://lupo.vteximg.com.br/arquivos/ids/173896-500-500/2820-branco.jpg?v=636348657338330000,https://www.lupo.com.br/meia-lupo-km-02820-001/p,12-04-2022
Meia Calça Lobinha Fina Bebê - Fio 20,"12,90",,0.0,Infantil,Meias-Calças,Fina,Características: Meia calça bebê. Fina em fio 20. Com demarcação e ponteira. Toque suave. Ajuste perfeito. Composição: 85% Poliamida no mínimo.,https://lupo.vteximg.com.br/arquivos/ids/180074-500-500/02571-001.jpg?v=636688154083700000,https://www.lupo.com.br/meia-calca-lobinha-kf-fina-02571-001/p,12-04-2022
Meia Calça Lobinha Cute - Fio 70,"26,90",6% elastano 94% poliamida,1.0,Infantil,Meias-Calças,Fashion,"Composição: 94% Poliamida , 6% Elastano",https://lupo.vteximg.com.br/arquivos/ids/178030-500-500/20170923_Lupo_Dia06_9151.jpg?v=636574116822070000,https://www.lupo.com.br/meia-calca-lobinha-cute-02554-001/p,12-04-2022
Meia Calça Lobinha Legging Jeans - Fio 150,"57,90",5% elastano 95% poliamida,1.0,Infantil,Meias-Calças,Legging,Características: Meia calça legging jeans. Toque suave. Ajuste perfeito. Composição: 95% Poliamida e 5% Elastano.,https://lupo.vteximg.com.br/arquivos/ids/177963-500-500/02542-001.jpg?v=636573961033000000,https://www.lupo.com.br/meia-calca-lobinha-kf-legging-jeans-02542-001/p,12-04-2022
Meia Calça Lobinha Ballet,"32,90",8% elastano 92% poliamida,1.0,Infantil,Meias-Calças,Fashion,Características: Meia calça infantil. Fio 40. Toque suave. Ajuste perfeito. Composição: 92% Poliamida e 8% Elastano.,https://lupo.vteximg.com.br/arquivos/ids/180071-500-500/02520-001.jpg?v=636688091992030000,https://www.lupo.com.br/meia-calca-lobinha-kf-ballet-02520-001/p,12-04-2022
Meia Calca Lobinha Estrela,"22,90",,0.0,Infantil,Meias-Calças,Fina,Características: Meia calça infantil. Com textura delicada. Toque suave. Ajuste perfeito. Composição: 85% Poliamida no mínimo.,https://lupo.vteximg.com.br/arquivos/ids/182335-500-500/02515-003-1000.jpg?v=636868928507400000,https://www.lupo.com.br/meia-calca-lobinha-kf-estrela-02515-003/p,12-04-2022
Meia Lupo Baby - 3/4,"15,90",23% poliamida 3% outra 74% algodao,1.0,Baby,Meias,Clássicas,"Composição: 3% Outra Fibra , 23% Poliamida , 74% Algodao",https://lupo.vteximg.com.br/arquivos/ids/168645-500-500/02055-001-1110.jpg?v=636325206220870000,https://www.lupo.com.br/meia-lupo-bu-3-4-02055-001/p,12-04-2022
Meia Lupo Baby,"11,90",3% outra 37% poliamida 60% algodão,1.0,Baby,Meias,Soquetes,"Composição: 3% Outra Fibra, 37% Poliamida, 60% Algodão",https://lupo.vteximg.com.br/arquivos/ids/183415-500-500/02005-003-4010.jpg?v=636869702136370000,https://www.lupo.com.br/meia-lupo-bu-lisa-02005-003/p,12-04-2022
Meia Lupo Classica,"18,90",100% poliamida,1.0,Adulto,Meias,Clássicas,Informações: Calcanhar Verdadeiro Cano 27cm Composição: 100% Poliamida,https://lupo.vteximg.com.br/arquivos/ids/167486-500-500/01110-032-6670.jpg?v=636325182820630000,https://www.lupo.com.br/meia-lupo-am-classica-01110-032/p,12-04-2022
Cueca Lupo Boxer - Canelada Com Abertura,"54,90",10% poliéster 4% elastano 5% elastano 86% algodão 95% algodão,2.0,Adulto,Cuecas,Boxer,Informações: Abertura Frontal Maior Praticidade Composição: Cor 8000: 86% Algodão 10% Poliéster 4% Elastano Demais cores: 95% Algodão 5% Elastano,https://lupo.vteximg.com.br/arquivos/ids/165351-500-500/00660-002-9990.jpg?v=636325144485500000,https://www.lupo.com.br/cueca-lupo-am-boxer-c-aber-00660-002/p,12-04-2022
Cueca Lupo Slip  - Canelada Com Abertura,"49,90",10% poliéster 4% elastano 5% elastano 86% algodão 95% algodão,2.0,Adulto,Cuecas,Slip,Informações: Abertura frontal Maior praticidade Composição: Cor 8000: 86% Algodão 10% Poliéster 4% Elastano Demais cores: 95% Algodão 5% Elastano,https://lupo.vteximg.com.br/arquivos/ids/164729-500-500/00546-002-2800.jpg?v=636325126169500000,https://www.lupo.com.br/cueca-lupo-am-slip-c-abert-00546-002/p,12-04-2022
Meia Pé Por Pé - Kit com 2 Pares  - Tamanho: U | Cor: Sortida | Calçado: 26 a 35,"43,90",3% elastano 97% poliamida,1.0,Infantil,Meias,Uau,"Composição: 97% Poliamida, 3% Elastano Calcanhar Verdadeiro Cano Longo",https://lupo.vteximg.com.br/arquivos/ids/192816-500-500/12000-0880904.jpg?v=637795209066300000,https://www.lupo.com.br/meia-pe-por-pe-ku-lupo-uau-kit2-12000-0880904/p,12-04-2022
Pijama Lupo Curto Caramelo,"143,90",100% algodão,1.0,Adulto,Pijamas,Pai e Filho,Composição: 100% Algodão,https://lupo.vteximg.com.br/arquivos/ids/193008-500-500/28180-001_MARINHO_0830_.jpg?v=637840934027370000,https://www.lupo.com.br/pijama-lupo-am-curto-caramelo-28180-001/p,12-04-2022
Camiseta Lupo LSport Ras,"126,90",100% poliamida,1.0,Adulto,Lupo Sport,Camisetas,Composição: 100% Poliamida,https://lupo.vteximg.com.br/arquivos/ids/193079-500-500/71696-001-5940.jpg?v=637844375705470000,https://www.lupo.com.br/camiseta-lupo-af-lsport-ras-71696-001/p,12-04-2022
Meia 3/4 Lupo,"30,90",26% poliamida 3% outra 71% algodao,1.0,Adulto,Meias,Soquetes,"Composição: 71% Algodao, 26% Poliamida, 3% Outra Fibra",https://lupo.vteximg.com.br/arquivos/ids/192317-500-500/04450-029-9980.jpg?v=637467759388830000,https://www.lupo.com.br/meia-34-lupo-af-04450-029/p,12-04-2022
Meia Quem Soltou o Pum Lupo Uau  - Tamanho: U | Cor: Yellow | Calçados: 26 a 35,"22,90",3% elastano 97% poliamida,1.0,Infantil,Meias,Uau,Composição: 97% Poliamida e 3% Elastano,https://lupo.vteximg.com.br/arquivos/ids/192693-500-500/12000-002a.jpg?v=637723222781300000,https://www.lupo.com.br/meia-quem-soltou-o-pum-12000-002/p,12-04-2022
Camiseta Lupo Comfortable VB,"152,90",100% poliamida,1.0,Adulto,Lupo Sport,Camisetas,Composição: 100% Poliamida,https://lupo.vteximg.com.br/arquivos/ids/192308-500-500/71600-002-9990.jpg?v=637467759208570000,https://www.lupo.com.br/camiseta-lupo-af-comfortable-vb-71600-002/p,12-04-2022
Meia Lupo Atemporal,"23,90",2% outra 23% poliamida 75% algodao,1.0,Adulto,Meias,Sportwear,"Composição: 75% Algodao, 23% Poliamida, 2% Outra Fibra",https://lupo.vteximg.com.br/arquivos/ids/192517-500-500/1211-005-2891.jpg?v=637599817720870000,https://www.lupo.com.br/meia-lupo-am-sportwear-01211-005/p,12-04-2022
Meia Lupo Kids,"18,90",22% poliamida 3% outra 75% algodao,1.0,Infantil,Meias,Soquetes,"Composição: 75% Algodao, 22% Poliamida, 3% Outra Fibra",https://lupo.vteximg.com.br/arquivos/ids/192516-500-500/02636-007.jpg?v=637599816285800000,https://www.lupo.com.br/meia-lupo-km-02636-007/p,12-04-2022
Maio Lupo Canelado - Com Costura,"159,90",100% poliamida 15% elastano 85% poliamida,2.0,Adulto,Lupo Sport,Maiôs/Macaquinhos/Sungas,"Composição: 85% Poliamida, 15% Elastano Forro: 100% Poliamida",https://lupo.vteximg.com.br/arquivos/ids/192709-500-500/28957-001-9990.png?v=637737956431570000,https://www.lupo.com.br/maio-lupo-af-canelado-28957-001/p,12-04-2022
Camiseta Lupo Poliester,"91,90",100% poliester,1.0,Adulto,Lupo Sport,Camisetas,"A camiseta Lupo de poliéster é ideal para os momentos de lazer e práticas de esportes. Ela possui modelagem mais soltinha e é leve, o que permite a execução de movimentos e máximo conforto durante o uso. Seu tecido de poliéster facilita a secagem em caso de suor excessivo durante as atividades. Composição: 100% Poliester",https://lupo.vteximg.com.br/arquivos/ids/192160-500-500/77097-001-8770.png?v=637467753099030000,https://www.lupo.com.br/camiseta-lupo-am-poliester-77097-001/p,12-04-2022
